Heading,Source,Date,Symbol
Results for the quarter and financial year ended 31st March 2024,Hindustan Unilever Limited,24 Apr 2024,HINDUNILVR
"Q4 results today: Axis Bank, Hindustan Unilever, LTIMindtree, among 23 companies to report Q4 earnings on April 24",Mint,24 Apr 2024,HINDUNILVR
HUL Q4 Results: Domestic volume growth of 2%; FMCG demand may improve gradually,CNBC TV18,24 Apr 2024,HINDUNILVR
HUL share price target: What should investors do with Hindustan Unilever shares post in-line Q4 results?,Zee Business,25 Apr 2024,HINDUNILVR
HUL Q4 Results Live: Company announces final dividend of Rs 24 per share,The Economic Times,24 Apr 2024,HINDUNILVR
Unilever's India quarterly profit disappoints; sees signs of rebound in rural sales,Reuters,24 Apr 2024,HINDUNILVR
"HUL's net profit dips 1.53% to Rs 2,561 crore in Q4 FY24",ET Retail,24 Apr 2024,HINDUNILVR
HUL turns focus on six key categories to spur growth,Financial Express,26 Apr 2024,HINDUNILVR
