Heading,Source,Date,Symbol,Month
Adani Ports Shares In Focus On Reporting Strong Growth In Cargo Volume In November,Goodreturns,2024-12-02,ADANIPORTS,2024-12
"Stocks to Watch, Dec 3: Cipla, Axis Bank, Swiggy, TaMo, Adani Ports, SBI",Business Standard,2024-12-03,ADANIPORTS,2024-12
63% upside? This Adani stock may deliver strong returns ahead; here's why,Business Today,2024-12-02,ADANIPORTS,2024-12
"Adani Ports records 36 MMT cargo volume in November, says growth driven by containers",Financial Express,2024-12-02,ADANIPORTS,2024-12
Adani Ports subsidiary Gopalpur Port's rating upgraded six notches post acquisition,The Economic Times,2024-12-02,ADANIPORTS,2024-12
"Adani Green Energy at Rs 800? Bernstein shares stock price targets for Ambuja, Adani Ports",Business Today,2024-12-03,ADANIPORTS,2024-12
Adani Group to Invest $2 Billion in European Ports,Adda247,2024-12-07,ADANIPORTS,2024-12
