Heading,Source,Date,Symbol,Month
"Amid regulatory overhaul, Axis Bank awaits RBI nod on Axis Finance's future",Business Standard,2024-12-02,AXISBANK,2024-12
"Stocks to buy today: Axis Bank, HDFC Bank among top 9 trading ideas for 5 December 2024",The Economic Times,2024-12-05,AXISBANK,2024-12
"Axis Bank launches ARISE Women s Savings Account , a comprehensive offering with Financial Solutions and Healthcare Benefits",Axis Bank,2024-12-05,AXISBANK,2024-12
"Stocks to Watch, Dec 3: Cipla, Axis Bank, Swiggy, TaMo, Adani Ports, SBI",Business Standard,2024-12-03,AXISBANK,2024-12
RBI policy: Two reasons why banking stocks are rising today,Business Today,2024-12-06,AXISBANK,2024-12
"Nifty, Sensex Extend Gains To Third Week As Tata Motors, Axis Bank Lead: Market Wrap",NDTV Profit,2024-12-06,AXISBANK,2024-12
"Intraday Stocks Recommendations Today, BUY: Axis Bank, PNB, Maharashtra Seamless - Check targets",ET Now,2024-12-04,AXISBANK,2024-12
"Axis Bank's 'Dil Se Open' campaign highlights employee commitment to financial support across 5,577 branches",MediaNews4U,2024-12-02,AXISBANK,2024-12
SBI To HDFC Bank — Savings Account Interest Rate Comparison,NDTV Profit,2024-12-05,AXISBANK,2024-12
"Japan's MUFG Bank, Koch Group gets CCI nod to buy stakes in Shiprocket",Business Standard,2024-12-03,AXISBANK,2024-12
Sebi issues notice for attachment of bank accounts of Rbep Entertainment,Business Standard,2024-12-02,AXISBANK,2024-12
"SBI, Axis, HDFC, ICICI, & Other Banking Shares React To New Amendment Bill",Free Press Journal,2024-12-04,AXISBANK,2024-12
Pricol plans to acquire Sundaram Auto Components' injection moulding biz,Business Standard,2024-12-02,AXISBANK,2024-12
