Heading,Source,Date,Symbol,Month
Bajaj Finance Share Price Live Updates: Bajaj Finance shows resilience in market,The Economic Times,2024-12-06,BAJAJFINSV,2024-12
RBL Bank shares sink as partnership on co-branded credit cards with Bajaj Finance ends,Moneycontrol,2024-12-02,BAJAJFINSV,2024-12
"How will Bajaj Finance, RBL Bank be impacted post ending their co-branded credit card deal",CNBC TV18,2024-12-02,BAJAJFINSV,2024-12
MC Exclusive | Bajaj Finance to halt co-branded credit cards business,Moneycontrol,2024-12-02,BAJAJFINSV,2024-12
RBL Bank shares tank on Bajaj Finance co-branded card decision; here are stock price targets,Business Today,2024-12-02,BAJAJFINSV,2024-12
"Bajaj Finserv Health aims to break even by FY27, says CEO Devang Mody",Business Standard,2024-12-02,BAJAJFINSV,2024-12
"DMart, Asian Paints, and Bajaj Finance underperform: Here’s how these bluechip companies facing heat from competition and disruption",Upstox,2024-12-04,BAJAJFINSV,2024-12
NFO Alert: Bajaj Finserv Mutual Fund launches healthcare fund,The Economic Times,2024-12-03,BAJAJFINSV,2024-12
RBI cancels registration of Zavron Finance over irregular lending practices,Business Standard,2024-12-02,BAJAJFINSV,2024-12
"Stocks to Buy today: Bajaj Housing Finance, Trent, JSW Energy & more",News9live,2024-12-06,BAJAJFINSV,2024-12
