Heading,Source,Date,Symbol
SBI Life & other insurance stocks tumble up to 8%. Here's why,The Economic Times,28 Nov 2024,SBILIFE
"Life insurance stocks fall; HDFC Life, SBI Life, Max Financial dip up to 7%",Business Standard,28 Nov 2024,SBILIFE
"Why LIC share price is ascending despite fall in SBI Life, HDFC Life, ICICI Prudential Life & other insurance stocks",Mint,28 Nov 2024,SBILIFE
"HDFC Life, SBI Life: Why did insurance stocks take big hit today?",Business Today,28 Nov 2024,SBILIFE
"Max Life, SBI Life deny speculative reports on bancassurance regulatory caps",CNBC TV18,28 Nov 2024,SBILIFE
"HDFC Life, SBI Life stock tumbles over 6% amid reports of IRDAI plan to introduce cap on insurance business emerging from banks",Upstox,28 Nov 2024,SBILIFE
"SBI Life, HDFC Life shares tumble",Financial Express,28 Nov 2024,SBILIFE
"SBI Life, HDFC Life stocks fall as FM Sitharaman advises banks to deter from selling insurance and focus...",Moneycontrol,19 Nov 2024,SBILIFE
"Hindalco Industries, SBI Life Insurance, 8 other stocks on analysts' 'buy' lists for 12 months | Note down targets",Zee Business,20 Nov 2024,SBILIFE
Broker’s call: SBI Life Insurance (Buy),BusinessLine,25 Nov 2024,SBILIFE
