Heading,Source,Date,Symbol
Adani Enterprises Q3 result: Profit drops sharply by 97% to Rs 58 crore,Business Standard,30 Jan 2025,ADANIENT
Adani Enterprises Q3 Results: Profit falls 97% YoY to Rs 58 crore,The Economic Times,30 Jan 2025,ADANIENT
Adani Enterprises Q3 Results: Net profit falls 97% to ₹58 crore,BusinessLine,30 Jan 2025,ADANIENT
Adani Enterprises shares dive 5% as Q3 profit slumps 97% to Rs 58 crore YoY. Details here,Business Today,30 Jan 2025,ADANIENT
Adani Enterprises Q3FY25 results: Net profit plunges 96.9% to Rs 58 crore,Business Standard,30 Jan 2025,ADANIENT
