Heading,Source,Date,Symbol
"Buy SBI Life, target price Rs 2,100: Motilal Oswal Financial Services",The Economic Times,25 Oct 2024,SBILIFE
SBI Life Insurance Company Q2 Results Live: Profit Rises by 39.25% YOY,Mint,24 Oct 2024,SBILIFE
SBI Life Insurance Q2 results: Net profit jumps 39% to Rs 529 crore,Business Standard,23 Oct 2024,SBILIFE
"SBI Life crack 5% on Q2 miss, but brokerages hope growth from new investments, product launches",Moneycontrol,24 Oct 2024,SBILIFE
"SBI Life Share Price: Insurance stock skids 5% after Q2 results; BUY, SELL or HOLD?",ET Now,24 Oct 2024,SBILIFE
SBI Life expects to grow at 15% in FY25 with protection and annuity expected to see revival in the second half,CNBC TV18,25 Oct 2024,SBILIFE
SBI Life Insurance Company Q2 Results: PAT Rises 39% To Rs 529 Cr; AUM Jumps 27%,Goodreturns,23 Oct 2024,SBILIFE
Why SBI Life stock fell 5% despite net profit rising 39% YoY; reasons here,Business Standard,24 Oct 2024,SBILIFE
"SBI Life Q2 preview: APE likely to grow 6% YoY led by new policy premiums, margins to slightly dip",Moneycontrol,22 Oct 2024,SBILIFE
