Heading,Source,Date,Symbol
"Bajaj Auto to invest over Rs 3,000 crore into finance subsidiary BACL",Business Standard,24 Mar 2024,BAJAJ-AUTO
"Bajaj Auto working on CNG bike, to hit road in June",The Economic Times,22 Mar 2024,BAJAJ-AUTO
"Bajaj Auto sales grow 11% to 43.5 lakh units in FY24, exports surge in March",Upstox,1 Apr 2024,BAJAJ-AUTO
"Bajaj Auto, Cipla, SBI among stocks eligible for same-day settlement from today",Moneycontrol,27 Mar 2024,BAJAJ-AUTO
"Bajaj Auto, TaMo: Strategies for Nifty50 stocks that doubled in FY24",Business Standard,28 Mar 2024,BAJAJ-AUTO
Bajaj Auto may further increase stake in e-mobility company Yulu,Times of India,13 Mar 2024,BAJAJ-AUTO
Bajaj Group commits Rs 5000 crore to CSR activities over a five year period,Autocar Professional,22 Mar 2024,BAJAJ-AUTO
"Bajaj Group commits Rs 5,000 crore for social initiatives under Bajaj Beyond",Financial Express,22 Mar 2024,BAJAJ-AUTO
"Slogans aren't enough, we need real skilling, says Rajiv Bajaj",Mint,23 Mar 2024,BAJAJ-AUTO
"Bajaj Auto share buyback: Key dates, retail acceptance ratio. Details here - Hindustan Times",Hindustan Times,6 Mar 2024,BAJAJ-AUTO
