Heading,Source,Date,Symbol
"Promoter of Shriram Finance sold over 59 lakh shares for Rs 1,427 crore",The Economic Times,28 Mar 2024,SHRIRAMFIN
"Nifty Rejig: Shriram Finance in, UPL out",Upstox,27 Mar 2024,SHRIRAMFIN
"Jio Financial Services Share Price Highlights: Stock gained 0.16% during today's trading session; Check price range, day's high and low",Business Today,21 Mar 2024,SHRIRAMFIN
"Aditya Birla Capital, subsidiary Aditya Birla Finance to merge",Mint,11 Mar 2024,SHRIRAMFIN
"Shriram Pistons rallies 7% as Emkay initiates coverage with 'buy' call, 70% upside",Moneycontrol,14 Mar 2024,SHRIRAMFIN
Shriram Finance plans to raise $200 million,The Economic Times,7 Mar 2024,SHRIRAMFIN
"Stock Of The Day: Shriram Pistons —Analyst View, Key Levels To Watch",NDTV Profit,14 Mar 2024,SHRIRAMFIN
"Bajaj Auto, TaMo: Strategies for Nifty50 stocks that doubled in FY24",Business Standard,28 Mar 2024,SHRIRAMFIN
"Nifty rejig on March 28: Adani Power, Jio Financial, HDFC Bank likely to see highest inflows",CNBC TV18,27 Mar 2024,SHRIRAMFIN
Shriram Finance raises $300 million via innovative ABS transaction,The Economic Times,19 Mar 2024,SHRIRAMFIN
