Heading,Source,Date,Symbol
Eicher Motors Ltd down for fifth straight session,Business Standard,10 Jan 2025,EICHERMOT
"Eicher Motors shares jump 9%, hits 52-week high after strong Royal Enfield sales in December",The Economic Times,2 Jan 2025,EICHERMOT
Eicher Motors shares rally 7% on solid December sales data; key details,Business Today,2 Jan 2025,EICHERMOT
"Stocks in news: Eicher Motors, Bajaj Finance & PNB among 7 stocks that hogged limelight today",Zee Business,2 Jan 2025,EICHERMOT
"CreditAccess Grameen, Bajaj Finance, Petronet LNG, Eicher Motors, Maruti, TCS, CSB Bank: Check top buzzing stocks of the day",Upstox,1 Jan 2025,EICHERMOT
Eicher Motors Share Price Live Updates: Eicher Motors Leads the Pack as a High Volume Gainer,The Economic Times,2 Jan 2025,EICHERMOT
"Maruti, Eicher Motors: Can auto stocks sustain the rally? Chart check here",Business Standard,2 Jan 2025,EICHERMOT
"Eicher Motors, Tata Consumer, Biocon & Chambal Fertilisers: 4 stock picks by SMC Global",Business Today,27 Jan 2025,EICHERMOT
Eicher Motors shares rally to new high on strong business updates for December,Upstox,2 Jan 2025,EICHERMOT
Eicher Motors Share Price Highlights: Eicher Motors Stock Price History,The Economic Times,7 Jan 2025,EICHERMOT
