Heading,Source,Date,Symbol
"HDFC Bank Q3 Results FY25 Live Updates: PAT at Rs 16,736 crore vs Street estimates of Rs 17,233 crore; HD...",The Economic Times,22 Jan 2025,HDFCBANK
"HDFC Bank, Bajaj Finance: 5 BFSI stock picks ahead of Q3 results, target prices",Business Today,6 Jan 2025,HDFCBANK
HDFC Bank Q3 results today: Here's what to expect - Hindustan Times,Hindustan Times,22 Jan 2025,HDFCBANK
"Hdfc Bank Share Price Highlights : Hdfc Bank closed today at ₹1749.3, down -2.46% from yesterday's ₹1793.35 | Stock Market News",Mint,3 Jan 2025,HDFCBANK
HDFC Bank gets RBI nod to hike group stake in 3 banks,Times of India,4 Jan 2025,HDFCBANK
ICICI Bank: Marching ahead of HDFC Bank?,Financial Express,26 Jan 2025,HDFCBANK
"After Axis, HDFC Bank, investors eye ICICI Bank Q3 results; what to expect?",Business Standard,23 Jan 2025,HDFCBANK
HDFC Bank Posts Profit Growth in Line With Analyst Expectations,Bloomberg.com,22 Jan 2025,HDFCBANK
"Buy HDFC Bank, target price Rs 1748: Motilal Oswal Financial Services",The Economic Times,8 Jan 2025,HDFCBANK
HDFC Bank Q3 2025 results: Net profit rises 2.2% - Hindustan Times,Hindustan Times,22 Jan 2025,HDFCBANK
