Heading,Source,Date,Symbol
"Hero MotoCorp hits 16-month low, stock down 24% from Feb high; here's why",Business Standard,17 Mar 2025,HEROMOTOCO
"Hero MotoCorp, India’s largest two-wheeler maker by volume, sees two senior level resignations",Times of India,20 Mar 2025,HEROMOTOCO
Hero MotoCorp Share Price Rises 2.3% After Hitting 52-Wk Low; Should You Consider Buying This Auto Stock?,Goodreturns,20 Mar 2025,HEROMOTOCO
Hero MotoCorp-backed Ather Energy may launch its IPO by mid-April,Business Today,19 Mar 2025,HEROMOTOCO
Two senior executives exit Hero MotoCorp: What’s behind the chaos?,Financial Express,20 Mar 2025,HEROMOTOCO
"7 Stocks to Buy for Short Term: Analysts recommend largecap, midcap scrips for 2 weeks; Godrej Consumer, Hero MotoCorp on the list",Zee Business,22 Mar 2025,HEROMOTOCO
Hero MotoCorp in Trouble: Losses and Pay Cuts Push Top Leaders Out,THE PHILOX,20 Mar 2025,HEROMOTOCO
