Heading,Source,Date,Symbol
Bajaj Finserv hits over 5-month high; stock surges 25% so far in CY25,Business Standard,25 Mar 2025,BAJAJFINSV
Bajaj Finance is on the verge of a breakout from an upward sloping channel; is it time to buy?,The Economic Times,17 Mar 2025,BAJAJFINSV
Where will Bajaj Finance be in 10 Years,Equitymaster,5 Mar 2025,BAJAJFINSV
Bajaj Finserv serves a winner - Industry News,Financial Express,19 Mar 2025,BAJAJFINSV
Bajaj Finance shares at 52-week high; 2 stock brokers still see double-digit returns ahead,Business Today,19 Mar 2025,BAJAJFINSV
"Stocks to Watch Today, 18th March 2025: Bajaj Finserv, Swiggy, HUL, JM Financial, and more",Groww,18 Mar 2025,BAJAJFINSV
"Bajaj Finance shares to cross ₹10,000? Large-cap stock hits new high on leadership ability; brokerages lift targets",Mint,21 Mar 2025,BAJAJFINSV
Bajaj Finance’s Rajeev Jain likely to be elevated to Bajaj Finserv’s board,Moneycontrol,19 Mar 2025,BAJAJFINSV
"Bajaj Finance shares jump over 4%, hit 52-week high. Here's why",The Economic Times,21 Mar 2025,BAJAJFINSV
Bajaj Finance is Up 31% in 2025. More Upside Ahead or Time to Book Profits?,Equitymaster,26 Mar 2025,BAJAJFINSV
