Heading,Source,Date,Symbol
"Eicher Motors Ltd spurts 0.4%, up for fifth straight session",Business Standard,26 Mar 2025,EICHERMOT
"Market Trading Guide: Eicher Motors, Hindalco Industries are stock recommendations for Friday",The Economic Times,6 Mar 2025,EICHERMOT
Eicher Motors shares rise on record Royal Enfield sales,Business Today,1 Apr 2025,EICHERMOT
Buy Eicher Motors; target of Rs 5665: Geojit Financial Services,TradingView,11 Mar 2025,EICHERMOT
March Auto Sales: Eicher Motors shares climb after selling 1 million vehicles in FY25,CNBC TV18,1 Apr 2025,EICHERMOT
"March vehicle sales: M&M reports 23% growth YoY, Eicher Motors 34%",Moneycontrol,1 Apr 2025,EICHERMOT
"Eicher Motors: 100x in the past, 30% CAGR post-Covid: What’s next?",The Indian Express,27 Mar 2025,EICHERMOT
"Auto stocks react to February sales data, Eicher Motors, TVS Motor, M&M lead gains",BusinessLine,3 Mar 2025,EICHERMOT
"Stocks to watch, March 3: Tata Motors, Maruti, Eicher Motors, NCC, Glenmark Pharma, Paytm, ACME Solar Holdings, and more",Upstox,2 Mar 2025,EICHERMOT
"Are Eicher Motors, HDFC Bank and MGL good investment picks now? What analysts say",Zee Business,3 Mar 2025,EICHERMOT
