Heading,Source,Date,Symbol
HDFC Life Insurance Company Ltd up for third consecutive session,Business Standard,11 Mar 2025,HDFCLIFE
"Buy HDFC Life, target price Rs 800: JM Financial",The Economic Times,19 Mar 2025,HDFCLIFE
HDFC Life is a one-eyed king among the blind | Stock Market News,Mint,17 Mar 2025,HDFCLIFE
"HDFC Life Insurance Dividend, Q4 Results 2025: Cash reward in board meeting? Quarterly earnings announcement schedule",ET Now,31 Mar 2025,HDFCLIFE
Buy HDFC Life Insurance Company; target of Rs 870: Sharekhan,Moneycontrol,5 Mar 2025,HDFCLIFE
"Insurance sector surge: SBI Life, Max Financial Services and HDFC Life among key stocks to watch as market sentiment shifts",Upstox,23 Mar 2025,HDFCLIFE
"HDFC Life Insurance Company Limited's (NSE:HDFCLIFE) top owners are public companies with 54% stake, while 27% is held by institutions",Simply Wall Street,11 Mar 2025,HDFCLIFE
"ICICI Bank, Titan, HDFC Life, Bajaj Finance: 12 largecap stocks that BofA likes for 10% to 42% upside",Business Today,7 Mar 2025,HDFCLIFE
February life insurance premiums drop 12%; private insurers grow 3%,CNBC TV18,11 Mar 2025,HDFCLIFE
HDFC Life Insurance Company - Positive Breakout: These 5 stocks close cross above their 200 DMAs,The Economic Times,20 Mar 2025,HDFCLIFE
