Heading,Source,Date,Symbol
Where to invest in a falling market? HDFC Bank & Cholamandalam Investment top buy for 1 year time horizon,The Economic Times,4 Mar 2025,HDFCBANK
"Jefferies Asia Forum: HDFC Bank, IDFC First Bank, Paytm, and others share growth strategies",Mint,25 Mar 2025,HDFCBANK
"Mcap of 8 top valued firms climbs ₹88,085.8 cr; HDFC Bank biggest gainer",Business Standard,30 Mar 2025,HDFCBANK
"Upcoming Q4 earnings and dividend: From TCS, Infosys to HDFC Bank, UltraTech watch out for these 10 companies",Financial Express,1 Apr 2025,HDFCBANK
"'SIP of Rs 5000 per month in Reliance, ICICI Bank, HDFC Bank would have given you...': Expert on long-term returns in stocks",Business Today,18 Mar 2025,HDFCBANK
Stock Radar | Why does it make sense to accumulate HDFC Bank at current levels? Ajit Mishra decodes,The Economic Times,24 Mar 2025,HDFCBANK
"Jefferies top financial bets: HDFC Bank, IDFC First, Paytm and more",Financial Express,25 Mar 2025,HDFCBANK
"MFs prefer pvt banks over IT, auto, PSU banks; increase value in HDFC Bank",Business Standard,18 Mar 2025,HDFCBANK
"IREDA, IRFC, Tata Motors, L&T, HDFC Bank & Asian Paints: What Rahul Ghose of Hedged says on these stocks",Business Today,5 Mar 2025,HDFCBANK
HDFC Bank Share Price Highlights: HDFC Bank Stock Price History,The Economic Times,7 Mar 2025,HDFCBANK
