Heading,Source,Date,Symbol
LTIMindtree Share Price Highlights: LTIMindtree Stock Price History,The Economic Times,27 Mar 2025,LTIM
Growth and margin woes likely to keep a lid on LTI Mindtree stock,Business Standard,3 Mar 2025,LTIM
"TCS, Infosys, Wipro, Tech Mahindra, LTIMindtree shares fall up to 19% on Trump tariffs; here are fresh price targets",Business Today,10 Mar 2025,LTIM
LTIMindtree share price target: BSE 100 stock down 14% YTD; Should you BUY?,ET Now,3 Mar 2025,LTIM
Intellect and LTIMindtree partner to transform Financial Services,BusinessLine,26 Mar 2025,LTIM
"LTIMindtree's Lambu to focus on agility, AI & cost efficiency",Times of India,13 Mar 2025,LTIM
"7 Stocks to Buy for Short Term: Analysts recommend largecap, midcap, smallcap scrips for 2 weeks; Bajaj Finserv, LTIMindtree on the list",Zee Business,27 Mar 2025,LTIM
"IT Stocks Today Infosys, Wipro, TCS, LTI Mindtree Shares Under Stress After Accenture Q2 Result",Goodreturns,21 Mar 2025,LTIM
"Intellect Design joins hands with LTIMindtree to transform financial services in MEA, APAC",Business Standard,26 Mar 2025,LTIM
LTIMindtree Share Price Highlights: LTIMindtree Stock Price History,The Economic Times,1 Apr 2025,LTIM
