Heading,Source,Date,Symbol
Negative Breakout on March 28: 4 stocks crossed below their 200 DMAs,The Economic Times,1 Apr 2025,M&M
It’s official: Ramganesh Iyer joins Mahindra Finance as Chief Operating Officer,People Matters - HR News,25 Mar 2025,M&M
Mahindra & Mahindra Ltd Slips 2.2%,Business Standard,10 Mar 2025,M&M
Mahindra and Mahindra Shares Decline 3% in Today's Session,Moneycontrol,24 Mar 2025,M&M
"Mahindra & Mahindra, Tesla: UBS upgrades M&M stock to buy, shares up 4%",Business Today,5 Mar 2025,M&M
Mahindra’s Farm Equipment Sector Sells 23880 Tractor Units in India during February 2025,Mahindra,3 Mar 2025,M&M
M&M Finance Q4 Results 2025 date and time: Quarterly earnings schedule of NBFC announced,ET Now,30 Mar 2025,M&M
Why M&M is down over 2% in a surging market - Market News,Financial Express,24 Mar 2025,M&M
Is There Now An Opportunity In Mahindra & Mahindra Limited (NSE:M&M)?,Simply Wall Street,10 Mar 2025,M&M
ET Awards 2024: Mahindra & Mahindra is the Company of the Year,The Economic Times,8 Mar 2025,M&M
