Heading,Source,Date,Symbol
"Apollo Hospitals in talks to sell stake in multispecialty clinics chain, IFC to exit",Moneycontrol,3 Oct 2024,APOLLOHOSP
"Invest more in healthcare with disease burden set to hit $3 trillion by 2035, says Apollo Hospitals’ Suneeta R",CNBC TV18,7 Oct 2024,APOLLOHOSP
Stock market today: Trade setup for Nifty 50 to global outlook amid Iran-Israel war; five stocks to buy or sell on Oct 8,Mint,8 Oct 2024,APOLLOHOSP
"Garmin, Apollo Hospitals join hands for health monitoring & wellness",The Economic Times,7 Oct 2024,APOLLOHOSP
Top 5 Hospital Stocks in India Poised for Major Growth in 2025,Equitymaster,19 Oct 2024,APOLLOHOSP
Quartet acts on USD298m Rasmeli buy in Apollo Healthco,Law.asia,29 Oct 2024,APOLLOHOSP
Mehta Equities’ top recommendation for the week include Bajaj Finserv and Jindal Steel,Financial Express,9 Oct 2024,APOLLOHOSP
Superstar Rajinikanth admitted to Chennai Hospital; condition 'stable',Business Standard,1 Oct 2024,APOLLOHOSP
Shardul Amarchand Mangaldas Advises Apollo Hospitals Enterpriseand Apollo Healthco In Relation To Investment By Advent International And Its Investment Into Keimed,BW Legal World,14 Oct 2024,APOLLOHOSP
4 Stocks in which promoters reduced their pledge to keep an eye on,Trade Brains,15 Oct 2024,APOLLOHOSP
