Heading,Source,Date,Symbol
Eicher Motors Shares Highlights: Eicher Motors Stock Price History,The Economic Times,11 Oct 2024,EICHERMOT
"Tata Motors falls most among Sensex and Nifty companies, down by 4%: Here's why - Hindustan Times",Hindustan Times,29 Oct 2024,EICHERMOT
"Stocks To Watch: Bajaj Housing Finance, Cyient DLM, Jana Small Finance Bank, Union Bank of India, Eicher Motors, Mahindra Logistics, Hyundai Motor India",Financial Express,22 Oct 2024,EICHERMOT
"M&M, Eicher Motors: Auto stocks jump post Oct sales data; Nifty Auto index rallies over 1%",Upstox,1 Nov 2024,EICHERMOT
"Tata Motors, Maruti, Bajaj Auto, TVS, Eicher Shares Fall 2-5%; Why Auto Stocks Are Down On October 3?",Goodreturns,3 Oct 2024,EICHERMOT
Reliance Industries Ltd drops for fifth straight session,Business Standard,7 Oct 2024,EICHERMOT
"Bajaj Auto, Hero MotoCorp, Maruti & Tata Motors shares bleed up to 10% today; what's next?",Business Today,17 Oct 2024,EICHERMOT
"Stock Market Today , October 23, 2024 LIVE UPDATES: Mahindra & Mahindra Ltd. Plummets on this trading day",ET Now,20 Nov 2024,EICHERMOT
"Royal Enfield bike sales up 31% at 1,10,574 units in October Eicher Motors",Zee Business,1 Nov 2024,EICHERMOT
"Share Market Highlights October 23, 2024: Sensex, Nifty end in red; Bajaj Finance gains nearly 5%",BusinessLine,23 Oct 2024,EICHERMOT
