Heading,Source,Date,Symbol
"Mahindra & Mahindra Finance Q2 results: Net profit rises 57% to ₹369 crore, revenue at ₹3,897 crore",Mint,22 Oct 2024,M&M
M&M Finance stock drops 8% on weak Q2 numbers; What should investors do?,Business Standard,23 Oct 2024,M&M
Mahindra & Mahindra Financial Services Q2 Update: Loan Disbursement Fell In September Quarter,NDTV Profit,3 Oct 2024,M&M
Mahindra Finance gets approval to launch co-branded credit cards with RBL Bank,CNBC TV18,28 Oct 2024,M&M
"Tech Mahindra Q2 Results: Profit zooms 153% YoY to Rs 1,250 crore, revenue up 3.5%",The Economic Times,19 Oct 2024,M&M
"Tech Mahindra shares gain over 3% after company beats Q2 estimate; Should you Buy, Sell, or Hold?",Financial Express,21 Oct 2024,M&M
"Stock Market Today , October 23, 2024 LIVE UPDATES: Mahindra & Mahindra Ltd. Plummets on this trading day",ET Now,20 Nov 2024,M&M
"Tata Motors, Maruti Suzuki, M&M: How to trade these 3 auto stocks",Business Today,17 Oct 2024,M&M
M&M Finance shares decline 6% after releasing Q2FY25 business update,Business Standard,4 Oct 2024,M&M
"Shares to buy or sell: Ruchit Jain of 5paisa recommends Tech Mahindra, HDFC Life today",Mint,15 Oct 2024,M&M
