Heading,Source,Date,Symbol
Axis Bank partners with VST Tillers Tractors Ltd to offer Financial Solutions to Farmers for Farm Equipments,Axis Bank,21 May 2024,AXISBANK
Axis Bank to bring in expats in latest move to woo global companies,Business Standard,7 May 2024,AXISBANK
"Axis Bank Share Price Highlights: Stock gained 0.90% during today's trading session; Check price range, day's high and low",Business Today,16 May 2024,AXISBANK
Axis Bank vs ICICI Bank: Which is the best Indian banking stock? | Stock Market News,Mint,20 May 2024,AXISBANK
SNG & Partners advises Axis Bank on debt funding to Prestige Group,Bar and Bench,8 May 2024,AXISBANK
Best Private Bank Stock: Axis Bank vs ICICI Bank,Equitymaster,16 May 2024,AXISBANK
Large Indian banks are expected to improve their asset quality in the current fiscal: S&P,The Economic Times,29 May 2024,AXISBANK
Kotak Mahindra Bank appoints Ketaki Bhagwati as an independent director on its Board,People Matters - HR News,22 May 2024,AXISBANK
"Share Market Highlights May 22, 2024: Sensex gains 267 pts; Nifty ends near 22,600; FMCG, realty stocks shine",BusinessLine,22 May 2024,AXISBANK
"Axis Bank defrauded of ₹22.29 crore by finance firm's directors, Mumbai police files charges",Mint,10 May 2024,AXISBANK
