Heading,Source,Date,Symbol
HDFC Life Insurance declares bonus worth Rs 3722 cr to policyholders,Business Standard,15 May 2024,HDFCLIFE
Life insurance April premiums look better than what they are. Here’s why,CNBC TV18,10 May 2024,HDFCLIFE
"Analyst Call Tracker | HDFC Life, HUL see upgrades despite underperforming",Moneycontrol,10 May 2024,HDFCLIFE
"HDFC Life declares all-time high bonus of Rs 3,722 crore for policyholders",Business Today,15 May 2024,HDFCLIFE
HDFC Life announces the 'No Jhanjhat Life Insurance Fatafat' campaign,BusinessLine,3 May 2024,HDFCLIFE
"Health insurance claim rejection: Widow fights, wins Rs 28 lakh damage; pre-existing disease can't be free",The Economic Times,14 May 2024,HDFCLIFE
Upstox enters Indian insurance space with HDFC Life as first partner,Life Insurance International,20 May 2024,HDFCLIFE
SBI Life Insurance Vs HDFC Life Insurance - Comparison & More,Trade Brains,1 May 2024,HDFCLIFE
"IDFC First Bank board approves plan to raise ₹3,200 cr via preferential issue",Mint,30 May 2024,HDFCLIFE
Ratan Tata-backed wealth management platform Upstox forays into insurance distribution business,Zee Business,21 May 2024,HDFCLIFE
