Heading,Source,Date,Symbol
Tata Motors Consolidated Q4 FY24 Results,Tata Motors,10 May 2024,TATAMOTORS
"Tata Motors Q4 Results Live Updates: PAT at Rs 17,410 crore, beats profit estimates by wide margin",The Economic Times,10 May 2024,TATAMOTORS
"Tata Motors Q4 net profit more than triples to Rs 17,407 crore on strong vehicle demand, revenue up 13%",Moneycontrol,10 May 2024,TATAMOTORS
"Tata Motors Q4 Preview: Robust sales, low commodity prices to aid earnings",Business Standard,9 May 2024,TATAMOTORS
"Tata Motors clocks 45% jump in net profit, management says India business now debt free",Financial Express,10 May 2024,TATAMOTORS
