Heading,Source,Date,Symbol
"Market Trading Guide: Wipro, Indian Bank among 8 stock recommendations for Thursday",The Economic Times,28 Aug 2024,WIPRO
"Stocks To Watch Today, Aug 28: SBI Cards, Wipro, Vi, Jio Fin, Orient Tech",Business Standard,28 Aug 2024,WIPRO
Wipro appoints Srikumar Rao as global head of engineering edge business line,CNBC TV18,30 Aug 2024,WIPRO
"Stocks to watch on August 28: LTIMindtree, UPL, Tata Technologies, Jio Financial Services, Wipro",Upstox,27 Aug 2024,WIPRO
"Stocks To Watch: HUL, NBCC, ICICI Prudential, Zydus Life, Wipro",Financial Express,28 Aug 2024,WIPRO
"Wipro, Dell Tech expand partnership to integrate AI enterprise solutions",Business Standard,27 Aug 2024,WIPRO
