Heading,Source,Date,Symbol,Month
"Stocks to Watch, Nov 26: HUL, SBI, Coal India, IndiGo, Adani Group shares",Business Standard,2024-11-26,COALINDIA,2024-11
Coal India floats tender seeking bids from private players for e-auction,Business Standard,2024-11-25,COALINDIA,2024-11
"IPOs of BCCL and CMPDI on track, DRHPs this fiscal",Financial Express,2024-11-25,COALINDIA,2024-11
"JSW, ACC among winners under latest coal mines auction",Financial Express,2024-11-27,COALINDIA,2024-11
Adopting ESG Standards In The Coal Industry: Coal India’s Commitment To Sustainability And Governance,SolarQuarter,2024-11-28,COALINDIA,2024-11
