Heading,Source,Date,Symbol
Bajaj Housing Finance’s IPO: A game-changer for Bajaj Finance? | Stock Market News,Mint,12 Jun 2024,BAJAJFINSV
"Bajaj Housing Finance files papers for Rs 7,000 crore IPO",The Economic Times,8 Jun 2024,BAJAJFINSV
The Bajaj Housing Finance IPO. Everything You Need to Know,Equitymaster,22 Jun 2024,BAJAJFINSV
Tata Motors ties up with Bajaj Finance for commercial vehicle finance,Business Standard,25 Jun 2024,BAJAJFINSV
"Bajaj Housing Finance board approves IPO with ₹4,000-crore fresh issue and OFS",CNBC TV18,6 Jun 2024,BAJAJFINSV
India's Bajaj Housing Finance files for $838 million IPO,Reuters,8 Jun 2024,BAJAJFINSV
"Bajaj Housing Finance files DRHP for Rs 7,000-cr IPO; parent Bajaj Finance to sell Rs 3,000-cr shares",Moneycontrol,14 Jun 2024,BAJAJFINSV
Tata Motors partners with Bajaj Finance for seamless Commercial Vehicle Financing,Tata Motors,25 Jun 2024,BAJAJFINSV
Bajaj Finserv Direct Expands Global Footprint with Technology Services Hub Launch in UAE,Elets BFSI,5 Jun 2024,BAJAJFINSV
"Bajaj Finance's housing finance arm announces IPO; to raise ₹4,000 cr via fresh issue",Fortune India,7 Jun 2024,BAJAJFINSV
