Heading,Source,Date,Symbol
Zomato to replace JSW Steel in BSE Sensex from December 23,The Economic Times,22 Nov 2024,JSWSTEEL
"Zomato to become part of BSE Sensex, replacing JSW Steel from December 23",Business Standard,22 Nov 2024,JSWSTEEL
Zomato to replace JSW steel in Sensex from December 23: BSE,Moneycontrol,22 Nov 2024,JSWSTEEL
Zomato to replace JSW Steel on Sensex from December 23: BSE,Upstox,22 Nov 2024,JSWSTEEL
BSE Sensex Rejig: New-age tech giant Zomato to replace JSW Steel on BSE Sensex index from December 23,Mint,22 Nov 2024,JSWSTEEL
Zomato to replace JSW Steel in the Sensex,BusinessLine,22 Nov 2024,JSWSTEEL
Zomato to replace JSW Steel in sensex,Times of India,23 Nov 2024,JSWSTEEL
