Heading,Source,Date,Symbol
LTIMindtree shares up 6% on securing its largest-ever $450 million deal,Business Standard,12 May 2025,LTIM
LTIMindtree Share Price Highlights: LTIMindtree Stock Price History,The Economic Times,14 May 2025,LTIM
LTIMindtree Shares In Focus Ahead Of Ex-Dividend Date,NDTV Profit,1 month ago,LTIM
"LTIMindtree bags $450-million deal with global firm, its largest",Financial Express,12 May 2025,LTIM
"Dividend Stocks This Week: Page Ind, Ashoka Leyland, LTI Mindtree Among 9 Stocks To Trade Ex-Dividend",News18,1 month ago,LTIM
LTIMindtree wins $450 million deal from ADM,The Times of India,13 May 2025,LTIM
LTIMindtree Full Year 2025 Earnings: EPS Misses Expectations,Simply Wall Street,10 May 2025,LTIM
"Dividend Stocks: Ashok Leyland, Havells India, LTIMindtree, among others to trade ex-dividend next week; Full list",Mint,17 May 2025,LTIM
LTIMindtree shares jump 7% today on $450 million order win. Details here,Business Today,12 May 2025,LTIM
LTIMindtree Share Price Highlights: LTIMindtree Stock Price History,The Economic Times,16 May 2025,LTIM
