Heading,Source,Date,Symbol
Bajaj Auto Dividend: Last Day To Buy Shares To Qualify — Details Here,NDTV Profit,3 weeks ago,BAJAJ-AUTO
Bajaj Auto Share Price Highlights: Bajaj Auto Stock Price History,The Economic Times,2 weeks ago,BAJAJ-AUTO
"Dividend stocks: Bajaj Auto, PNB, Tata Power, 10 others to remain in focus",Business Standard,3 weeks ago,BAJAJ-AUTO
"Rs 210 Dividend, Highest Ever By Bajaj Group Stock: Bajaj Auto To Turn Ex-Date On June 20, BUY/HOLD/SELL?",Goodreturns,3 weeks ago,BAJAJ-AUTO
Bajaj Auto Dividend 2025: Record date for 2100% reward fixed,ET Now,1 month ago,BAJAJ-AUTO
Hobson’s choice for Bajaj Auto on lifeline for KTM - Bike News,Financial Express,1 month ago,BAJAJ-AUTO
"Bajaj Auto, Tata Power among 13 companies to trade ex-dividend on Friday. Last chance to buy!",The Economic Times,3 weeks ago,BAJAJ-AUTO
"Dividend Stocks To Watch This Week — Honeywell Automation, Bajaj Auto, Tata Communications, Hindustan Zinc",NDTV Profit,4 weeks ago,BAJAJ-AUTO
"Bajaj Auto, Tech Mahindra, L&T Tech: Analyst pick 3 stocks to buy today",Business Standard,1 month ago,BAJAJ-AUTO
Rs 210 Dividend Bonanza! Don’t Miss Out Record Date Approaching Fast; Buy Bajaj Auto Now Or Wait?,Goodreturns,1 month ago,BAJAJ-AUTO
