Heading,Source,Date,Symbol
"Buy, Sell Or Hold: Cipla, Premier Energies, Bajaj Finance, Tata Motors, Tilaknagar Industries — Ask Profit",NDTV Profit,4 weeks ago,CIPLA
Cipla share price rises 2.09% in today's trade,Moneycontrol,4 weeks ago,CIPLA
What is Cipla’s prescription for FY26 after 22 patent grants? 5 key takeaways from FY25 annual report,Financial Express,2 weeks ago,CIPLA
"Pharma stocks to buy: Cipla, Lupin, among 5 stocks with upside potential of up to 12%",The Economic Times,1 month ago,CIPLA
Volumes jump at FDC Ltd counter,Business Standard,4 weeks ago,CIPLA
"Dividend Stocks: Hindustan Unilever, Cipla, Vedanta, among others to trade ex-dividend next week; Full list",Mint,3 weeks ago,CIPLA
"Stocks To Buy: Aarti Industries, Cipla, CAMS, Policy Bazaar, Rashtriya Chemicals",NDTV Profit,1 month ago,CIPLA
Cipla Shares Fall in Today's Trading Session Amid High Volume Activity,Moneycontrol,1 month ago,CIPLA
"Markets gather momentum in afternoon trade: Nifty, Sensex rally nearly 1%; Financials, tech the big stars",Financial Express,4 weeks ago,CIPLA
"Breakout stocks: Nifty Pharma, Biocon, Cipla break over 200-DMA; what next?",Business Standard,1 month ago,CIPLA
