Heading,Source,Date,Symbol
"HDFC Life Insurance Company Ltd spurts 1.21%, up for five straight sessions",Business Standard,2 weeks ago,HDFCLIFE
HDFC Life Insurance Company - At multi-year highs: These 8 stocks witness 5-year swing high breakout,The Economic Times,2 weeks ago,HDFCLIFE
2 Insurance stocks seeing strong accumulation. Is a rally on the cards?,Financial Express,3 weeks ago,HDFCLIFE
HDFC Life Insurance Dividend: Last Day To Buy Shares To Qualify — Details Here,NDTV Profit,3 weeks ago,HDFCLIFE
"HSBC bullish on life-insurance stocks as earnings risk appear low, prefers HDFC Life",Moneycontrol,1 month ago,HDFCLIFE
"HDFC Life declares record ₹4,102 crore bonus for policyholders",CNBC TV18,1 month ago,HDFCLIFE
Is Now The Time To Put HDFC Life Insurance (NSE:HDFCLIFE) On Your Watchlist?,Simply Wall Street,1 month ago,HDFCLIFE
HDFC Life banks on broader playbook to keep its lead—but analysts see a margin worry | Company Business News,Mint,2 weeks ago,HDFCLIFE
HDFC Life Insurance Company Ltd gains for third straight session,Business Standard,2 weeks ago,HDFCLIFE
HDFC Life Share Price Highlights: HDFC Life Stock Price History,The Economic Times,3 weeks ago,HDFCLIFE
