Heading,Source,Date,Symbol
Hindalco Industries Ltd up for fifth session,Business Standard,2 weeks ago,HINDALCO
Hindalco Industries - ​These 6 stocks showing RSI Trending Up on June 20,The Economic Times,3 weeks ago,HINDALCO
Hindalco Industries Shows Strong Financial Growth and Market Dominance Amid Evaluation Adjustment,MarketsMojo,1 month ago,HINDALCO
Hindalco Industries Shares Fall More Than 1.1% in Today's Trading Session,Moneycontrol,1 month ago,HINDALCO
"JSW Steel, Vedanta Preferred By Investec As Cost Tailwinds Seen; Hindalco Industries Gets Downgrade",NDTV Profit,1 month ago,HINDALCO
"Hindalco to buy AluChem for $125 million, its 3rd US deal",Times of India,2 weeks ago,HINDALCO
"Jio Financial, Tata Steel, Hindalco & IRFC shares: Poised for a technical takeoff?",Business Today,2 weeks ago,HINDALCO
"Hindalco Q1 Results FY 2025-2026 date, time: Aditya Birla Group firm’s quarterly earnings announcement schedule",ET Now,2 weeks ago,HINDALCO
"Hindalco Industries Ltd spurts 0.28%, up for five straight sessions",Business Standard,1 month ago,HINDALCO
Hindalco Industries Reports Strong Growth and Solid Market Position in Non-Ferrous Metals Sector,MarketsMojo,2 weeks ago,HINDALCO
