Heading,Source,Date,Symbol
ITC shares experience high trading volume amid slight gains,Moneycontrol,4 weeks ago,ITC
"Buy, Sell Or Hold: ITC Hotels, Bajaj Finance, JSW Infra, Aster DM Healthcare, Jyothi Lab— Ask Profit",NDTV Profit,1 month ago,ITC
BAT may begin phased stake sale in ITC Hotels: Sources,The Economic Times,4 weeks ago,ITC
"ITC Ltd spurts 0.9%, up for fifth straight session",Business Standard,1 month ago,ITC
"From ITC, Gensol Engineering, Nestle India to Texmaco Rail – Here are 10 stocks to watch",Financial Express,1 month ago,ITC
ITC bets on buyouts to grow food business,Times of India,1 month ago,ITC
ITC completes acquisition of 100% stake of Sresta Natural Bioproducts for ₹400 crore,CNBC TV18,1 month ago,ITC
ITC shares in focus after Rs 472 crore acquisition of Sresta Natural Bioproducts,The Economic Times,4 weeks ago,ITC
ITC Shares Trade Near Day's Low Despite Strong Financial Performance,Moneycontrol,2 weeks ago,ITC
"GQG plans to raise stake in ITC, ITC Hotels",Financial Express,1 month ago,ITC
