Heading,Source,Date,Symbol
SBI Life Insurance Company Ltd rises for third straight session,Business Standard,2 weeks ago,SBILIFE
Navigating Growth: Insights into the Life Insurance Sector,The Economic Times,1 month ago,SBILIFE
"Insurance stocks rally not over yet, says Bernstein; positive on Max Financial, SBI Life",Moneycontrol,1 month ago,SBILIFE
Those who invested in SBI Life Insurance (NSE:SBILIFE) five years ago are up 134%,Simply Wall Street,3 weeks ago,SBILIFE
SBI Life Insurance Sees Surge in Open Interest Amid Increased Derivatives Activity,MarketsMojo,3 weeks ago,SBILIFE
2 Insurance stocks seeing strong accumulation. Is a rally on the cards?,Financial Express,3 weeks ago,SBILIFE
"LIC, SBI Life-owned NBFC Stock Under Rs 50 Recovers As Debt Obligations Met in Full",Times Now,3 weeks ago,SBILIFE
SBI Life crowdsources future-facing AI solutions from India's Next-Gen Talent pool at the 2025 Hack-AI-Thon finale,Yahoo Finance,3 weeks ago,SBILIFE
HSBC is bullish on life insurance stocks — Here's why it prefers HDFC Life,CNBC TV18,1 month ago,SBILIFE
"LIC, SBI Life-owned NBFC stock under ₹50 rebounds from today's low; here's why",Mint,3 weeks ago,SBILIFE
