Heading,Source,Date,Symbol
Tata Consumer Products Ltd drops for fifth straight session,Business Standard,4 weeks ago,TATACONSUM
Looking for acquisition opportunities while prioritising organic growth: Tata Consumer Products,Financial Express,3 weeks ago,TATACONSUM
TATA Consumer Products shares rise in today's session,Moneycontrol,1 month ago,TATACONSUM
Tata Consumer Products - These 5 stocks showing RSI Trending Up on June 23,The Economic Times,2 weeks ago,TATACONSUM
Tata Consumer shares: Nuvama sees further upside potential; retains 'BUY' rating,Business Today,3 weeks ago,TATACONSUM
"‘Markets witnessing significant shifts in consumer behaviour, business models’ says Tata Consumer Products",The Hindu,3 weeks ago,TATACONSUM
Tata Consumer Products keeps its ‘antennas up’ for strategic acquisitions,Mint,3 weeks ago,TATACONSUM
Tata Consumer Sees Urban Demand For Convenience Fuelling Next Gen Brands,NDTV Profit,3 weeks ago,TATACONSUM
"Tata Consumer Products allots 4,368 equity shares",Business Standard,1 month ago,TATACONSUM
Air India crisis: Chandra skips Tata Consumer AGM,The Times of India,3 weeks ago,TATACONSUM
