Heading,Source,Date,Symbol
HUL Share Price Highlights: HUL Stock Price History,The Economic Times,18 Feb 2025,HINDUNILVR
"Stock Recommendations Today: Shriram Finance, Maruti Suzuki, HUL, Nazara Tech On Brokerages Radar",NDTV Profit,18 Feb 2025,HINDUNILVR
"ITC, United Spirits, HUL, Nestle: Defensive stocks back in flavour; here are top picks",Business Today,19 Feb 2025,HINDUNILVR
Hindustan Unilever Limited's (NSE:HINDUNILVR) 3.5% loss last week hit both individual investors who own 62% as well as institutions,Simply Wall Street,20 Feb 2025,HINDUNILVR
Sarthak Advocates advises HUL on acquisition of palm oil business of Vishwatej Oil,Bar and Bench,22 Feb 2025,HINDUNILVR
