Heading,Source,Date,Symbol
LTIMindtree Ltd slips for fifth straight session,Business Standard,25 Feb 2025,LTIM
LTIMindtree needs to go off the beaten track,Financial Express,24 Feb 2025,LTIM
LTIMindtree Share Price Highlights: LTIMindtree Stock Price History,The Economic Times,14 Feb 2025,LTIM
Eurobank Collaborates with LTIMindtree for a Multi-Year Banking Technology Program,Business Wire,17 Feb 2025,LTIM
"Coforge, Mphasis, Wipro, Birlasoft, LTIMindtree, Firstsource, Infosys: IT stocks to buy",Business Today,14 Feb 2025,LTIM
"Want a payhike? Clear an exam first, LTI Mindtree tells staff | Company Business News",Mint,28 Feb 2025,LTIM
"Clear test for appraisal: LTIMindtree's new diktat for top managers, says report",Moneycontrol,28 Feb 2025,LTIM
Eurobank and LTIMindtree partner to launch global delivery centre in Pune,BusinessLine,17 Feb 2025,LTIM
LTIMindtree Partners with Eurobank for Banking Tech Transformation,India Infoline,18 Feb 2025,LTIM
"LTI Mindtree, Infosys, Others Boost Nifty IT Index, Ending 7-Day Downtrend With Gains Up To 2%",News18,19 Feb 2025,LTIM
