Heading,Source,Date,Symbol
"Bajaj Finance, Shriram Finance, Cholamandalam & other NBFC stocks jump up to 6% after RBI eases risk weight norms",Mint,27 Feb 2025,SHRIRAMFIN
"Axis Bank, Shriram Finance, Chola Finance Holdings: How to trade these 3 financial stocks",Business Today,27 Feb 2025,SHRIRAMFIN
"Market Trading Guide: Shriram Finance, Indian Hotels are stock recommendations for Friday",The Economic Times,20 Feb 2025,SHRIRAMFIN
Shriram Finance eyes 20-fold growth over next 3 years in green portfolio,Business Standard,11 Feb 2025,SHRIRAMFIN
RBI imposes ₹5.8 lakh penalty on Shriram Finance for KYC and credit data breaches,CNBC TV18,14 Feb 2025,SHRIRAMFIN
"Stocks to buy: Top stock recommendations for the week starting February 17, 2025",Times of India,17 Feb 2025,SHRIRAMFIN
Stock to buy today: Shriram Finance (₹607),BusinessLine,28 Feb 2025,SHRIRAMFIN
RBI imposes monetary penalty of Rs 5.80 lakh on Shriram Finance Ltd,UNITED NEWS OF INDIA,14 Feb 2025,SHRIRAMFIN
Institutional investors have a lot riding on Shriram Finance Limited (NSE:SHRIRAMFIN) with 42% ownership,Simply Wall Street,23 Feb 2025,SHRIRAMFIN
Shriram Finance raises $500mn via ECB,Zee Business,13 Feb 2025,SHRIRAMFIN
