Heading,Source,Date,Symbol,Month
"Adani Enterprises shares surge 4% after Ventura gives Rs 3,801 target price",The Economic Times,2024-12-30,ADANIENT,2024-12
Adani Enterprises jumps 4% in trade; here's why stock is in demand,Business Standard,2024-12-30,ADANIENT,2024-12
"Adani group to exit Adani Wilmar, sell stake to raise over $2 billion",Times of India,2024-12-30,ADANIENT,2024-12
Adani Enterprises to exit consumer goods joint venture with Wilmar Intl,Business Standard,2024-12-30,ADANIENT,2024-12
Adani Ent to exit Adani Wilmar JV; Group shares rally up to 15% in weak mkt,Business Standard,2024-12-30,ADANIENT,2024-12
"Stocks to Watch, Dec 31, 2024: RIL, Lupin, ITC, Adani Enterprises, SpiceJet",Business Standard,2024-12-31,ADANIENT,2024-12
Adani Enterprises to exit FMCG business,Financial Express,2024-12-30,ADANIENT,2024-12
Adani Wilmar shares slide 7% as Adani Enterprises announces exit from Wilmar JV in $2 billion deal,The Economic Times,2024-12-31,ADANIENT,2024-12
Adani Enterprises shares: Ventura cuts AEL stock price target by 37%; here's why,Business Today,2024-12-30,ADANIENT,2024-12
Adani Enterprises Surges 7% After Announcing Stake Sale in Adani Wilmar!,Business Today,2024-12-30,ADANIENT,2024-12
JPMorgan maintains 'Underweight' rating on Adani Wilmar; share tanks 8%,Business Standard,2024-12-31,ADANIENT,2024-12
Adani Group stock to buy now for an upside of more than 45%; Do you own it?,Trade Brains,2024-12-31,ADANIENT,2024-12
Adani Wilmar Shares Tank 8% As Adani Enterprises Exits Joint Venture With Wilmar Group; Buy Or Not?,Goodreturns,2024-12-31,ADANIENT,2024-12
Adani Enterprises to fully exit Adani Wilmar in $2 bn multi-phased deal,The Economic Times,2024-12-30,ADANIENT,2024-12
Adani Enterprises share price zooms 7% after brokerage predicts over 50% upside - Check target,ET Now,2024-12-30,ADANIENT,2024-12
"Adani to exit Wilmar Joint Venture, to sell 44% in FMCG company for $2 billion",Times of India,2024-12-31,ADANIENT,2024-12
Adani Group Completes $2 Billion Exit from Consumer Goods Venture Adani Wilmar,Goodreturns,2024-12-30,ADANIENT,2024-12
Newsmakers of the year | Down but never out: Adani’s resilience and relentless growth amid crisis,Financial Express,2024-12-30,ADANIENT,2024-12
Adani Green Energy's CEO Amit Singh to step down for new role in group,Business Standard,2024-12-30,ADANIENT,2024-12
