Heading,Source,Date,Symbol,Month
"Adani Enterprises revenue to jump to Rs 1.5 lakh crore, net earnings to rise 46% by FY27: Brokerage",The Economic Times,2024-12-29,ADANIENT,2024-12
Adani Group firms' balance sheet improved in 2 years; debt rose: Bernstein,Business Standard,2024-12-03,ADANIENT,2024-12
Adani Group Stocks Surge: Adani Ports Up 6% - Business News,Rediff,2024-12-03,ADANIENT,2024-12
"Adani Enterprises shares surge 4% after Ventura gives Rs 3,801 target price",The Economic Times,2024-12-30,ADANIENT,2024-12
Adani Enterprises jumps 4% in trade; here's why stock is in demand,Business Standard,2024-12-30,ADANIENT,2024-12
"Adani group to exit Adani Wilmar, sell stake to raise over $2 billion",Times of India,2024-12-30,ADANIENT,2024-12
Adani Enterprises to exit consumer goods joint venture with Wilmar Intl,Business Standard,2024-12-30,ADANIENT,2024-12
Adani Ent to exit Adani Wilmar JV; Group shares rally up to 15% in weak mkt,Business Standard,2024-12-30,ADANIENT,2024-12
"Stocks to Watch, Dec 31, 2024: RIL, Lupin, ITC, Adani Enterprises, SpiceJet",Business Standard,2024-12-31,ADANIENT,2024-12
Adani Enterprises to exit FMCG business,Financial Express,2024-12-30,ADANIENT,2024-12
Adani Wilmar shares slide 7% as Adani Enterprises announces exit from Wilmar JV in $2 billion deal,The Economic Times,2024-12-31,ADANIENT,2024-12
"Stocks to Watch, Dec 4: Swiggy, Adani Group shares, Vedanta, GMR Airports",Business Standard,2024-12-04,ADANIENT,2024-12
Adani Enterprises shares: Ventura cuts AEL stock price target by 37%; here's why,Business Today,2024-12-30,ADANIENT,2024-12
"Adani Group Companies Add Nearly Rs 27,000 Crore To Investors Wealth As Most Stocks Rise",NDTV Profit,2024-12-12,ADANIENT,2024-12
Adani Enterprises shares down 1%; favourable ruling in Dharavi redevelopment case fails to cheer up stock,Financial Express,2024-12-20,ADANIENT,2024-12
Hindenburg selloff & now: 4 likely reasons why Adani stocks fared better this time,Business Today,2024-12-03,ADANIENT,2024-12
"Adani Group shares trade firm; Power, Green Energy stocks gain up to 9%",Business Standard,2024-12-12,ADANIENT,2024-12
Adani Enterprises Surges 7% After Announcing Stake Sale in Adani Wilmar!,Business Today,2024-12-30,ADANIENT,2024-12
Gautam Adani hikes stake in two group companies,ET EnergyWorld,2024-12-19,ADANIENT,2024-12
JPMorgan maintains 'Underweight' rating on Adani Wilmar; share tanks 8%,Business Standard,2024-12-31,ADANIENT,2024-12
GQG Partners stocks slide 13% on analyst downgrade; Adani Group stocks hold steady in Monday trade,Financial Express,2024-12-02,ADANIENT,2024-12
Adani Group stock to buy now for an upside of more than 45%; Do you own it?,Trade Brains,2024-12-31,ADANIENT,2024-12
Adani stocks rally up to 6% after FBI director Chris Wray's resignation,The Economic Times,2024-12-12,ADANIENT,2024-12
Adani Group going green: Are critics green with envy? - Opinion News,Financial Express,2024-12-06,ADANIENT,2024-12
Adani Wilmar Shares Tank 8% As Adani Enterprises Exits Joint Venture With Wilmar Group; Buy Or Not?,Goodreturns,2024-12-31,ADANIENT,2024-12
"Adani Group is on better financial footing now than during Hindenburg attack, says Bernstein",Deccan Herald,2024-12-03,ADANIENT,2024-12
Adani Green Energy shares jump 9% in morning trade,The Indian Express,2024-12-02,ADANIENT,2024-12
"Stock Market Highlights: Sensex ends flat at 81,510, Nifty at 24,610; Adani Group shares dip",Business Standard,2024-12-10,ADANIENT,2024-12
Adani Enterprises to fully exit Adani Wilmar in $2 bn multi-phased deal,The Economic Times,2024-12-30,ADANIENT,2024-12
Adani Group most attractive among Indian investment grade cos: Nomura,Business Standard,2024-12-09,ADANIENT,2024-12
Adani Enterprises share price zooms 7% after brokerage predicts over 50% upside - Check target,ET Now,2024-12-30,ADANIENT,2024-12
Adani Group in better financial position than during Hindenburg episode: Bernstein,Upstox,2024-12-03,ADANIENT,2024-12
Adani Group acquires Air Works to boost defence business,Mint,2024-12-23,ADANIENT,2024-12
"Adani to exit Wilmar Joint Venture, to sell 44% in FMCG company for $2 billion",Times of India,2024-12-31,ADANIENT,2024-12
"Adani Enterprises, Adani Ports and other Adani shares in focus: JP Morgan Overweight on 4 Adani Group bonds",Financial Express,2024-12-06,ADANIENT,2024-12
"Ambuja Cements shares jump over 1% as Adani Group merges Sanghi Industries, Penna Cement",The Economic Times,2024-12-18,ADANIENT,2024-12
Adani Group plans Rs 20K crore super critical thermal power plant in Bihar,Business Standard,2024-12-20,ADANIENT,2024-12
Adani Group to acquire Air Works for enterprise value of Rs 400 crore,Moneycontrol,2024-12-24,ADANIENT,2024-12
Flying High: Adani Group to acquire 85.8% stake in Air Works for Rs 400 crore,Financial Express,2024-12-23,ADANIENT,2024-12
JP Morgan sees no signs of stress across key Adani Group entities,Business Standard,2024-12-06,ADANIENT,2024-12
Adani Group Completes $2 Billion Exit from Consumer Goods Venture Adani Wilmar,Goodreturns,2024-12-30,ADANIENT,2024-12
10 Adani Group Stocks Settle Higher; Adani Ports Jumps Over 5%,NDTV,2024-12-26,ADANIENT,2024-12
"Adani Group plans to invest ₹20,000 crore in thermal power plant in Bihar",Hindustan Times,2024-12-20,ADANIENT,2024-12
SECI changes bidding policy after bribery allegations on Adani Group,Business Standard,2024-12-16,ADANIENT,2024-12
Newsmakers of the year | Down but never out: Adani’s resilience and relentless growth amid crisis,Financial Express,2024-12-30,ADANIENT,2024-12
Adani Green Energy's CEO Amit Singh to step down for new role in group,Business Standard,2024-12-30,ADANIENT,2024-12
"Adani Group Shares Rally: Adani Ports Leads Gains As Sensex, Nifty Surge",ABP Live English,2024-12-03,ADANIENT,2024-12
"Adani Group to invest Rs 28,000 crore in Bihar for power, cement, food processing projects",The Economic Times,2024-12-20,ADANIENT,2024-12
Why Adani Group opted out of $553 mn US funding for Colombo port project,Business Standard,2024-12-11,ADANIENT,2024-12
Adani Group on solid financial footing despite US-related developments: Bernstein,Siasat.com,2024-12-03,ADANIENT,2024-12
"Civil Aviation Minister affirms fair process in airport leasing to Adani Group, dismisses Opposition’s irregularity claims",Financial Express,2024-12-05,ADANIENT,2024-12
Adani Group proposes eco corridor to foster industrial growth in Odisha,Times of India,2024-12-07,ADANIENT,2024-12
"Adani group’s solar power contracts priced lower than competitors, could find new buyers if canceled, say analysts",Financial Express,2024-12-08,ADANIENT,2024-12
Adani Group Announces Rs. 7.5 Lakh Crore Investment Plan For Rajasthan,NDTV,2024-12-09,ADANIENT,2024-12
AlphaNeon Group and Urja-Adani Join Hands for Strategic Expansion in Indias Financial Trade Sector,The Tribune,2024-12-28,ADANIENT,2024-12
