Heading,Source,Date,Symbol,Month
Share price of Divis Labs as Nifty,The Economic Times,2024-12-13,DIVISLAB,2024-12
Divi's Labs shares fall nearly 3% as US court says Novartis cannot block generic of best-selling heart...,Moneycontrol,2024-12-05,DIVISLAB,2024-12
Divi's Labs says 'no material impact' due to Novartis losing appeal in US district court,CNBC TV18,2024-12-05,DIVISLAB,2024-12
Indian pharma industry: A comparative analysis of Sun Pharma and Divi's Laboratories,Upstox,2024-12-03,DIVISLAB,2024-12
Divi's Lab stock slips on US supply worries,The Economic Times,2024-12-06,DIVISLAB,2024-12
"Stock recommendations by analyst for December 2: Larsen & Toubro, Divi's Labs and Azad Engineering",BUSINESS TODAY,2024-12-02,DIVISLAB,2024-12
Divi's Laboratories shares slip 6% in trade; what's worrying investors?,Business Standard,2024-12-05,DIVISLAB,2024-12
"Uncertainty over US Biosecure Act weighs heavy on Divi's Labs, Neuland Labs, Piramal Pharma",Moneycontrol,2024-12-09,DIVISLAB,2024-12
Divis Labs shares drop 0.58% as Sensex falls,The Economic Times,2024-12-16,DIVISLAB,2024-12
"NCC, Divi's Labs among top picks by Ajit Mishra of Religare Broking",Business Standard,2024-12-05,DIVISLAB,2024-12
"Market Trading Guide: Divi’s Lab, Torrent Pharma are 7 stock recommendations for Monday",The Economic Times,2024-12-01,DIVISLAB,2024-12
Hot Stocks: Brokerage view on Godrej Properties & Divi’s Lab; CLSA initiates coverage on Swiggy,The Economic Times,2024-12-10,DIVISLAB,2024-12
"Divi's Lab, Syngene International, other pharma CDMO stocks fall as US softens stance on Biosecure Act",Upstox,2024-12-08,DIVISLAB,2024-12
"Stocks To Buy Today, Brokerages Recommendation: ONGC, Godrej Properties, Swiggy, Divi's Laboratories and more",ET Now,2024-12-10,DIVISLAB,2024-12
"Why are shares of Divi’s Lab, Neuland Lab, and other Pharma CDMO stock falling?",Trade Brains,2024-12-10,DIVISLAB,2024-12
Alkem Laboratories rises 3% in trade; What is driving this pharma stock,Business Standard,2024-12-18,DIVISLAB,2024-12
Why Neuland Laboratories shares fall 7% in trade? check reasons here,Business Standard,2024-12-12,DIVISLAB,2024-12
"Divi's Labs, HEG Ltd, Swiggy, Zomato, Kalpataru Projects, Genus Power, Vi, Reliance Power: Check top buzzing stocks of the day",Upstox,2024-12-05,DIVISLAB,2024-12
"CDMO shares under pressure; Neuland, Laurus, Syngene tank up to 12%",Business Standard,2024-12-09,DIVISLAB,2024-12
"Share Market Highlights: Sensex, Nifty surge 1% as IT stocks rally on positive US economic outlook",BusinessLine,2024-12-05,DIVISLAB,2024-12
"RBI approves Canara Bank's stake sale in MF, insurance subsidiaries via IPO",Business Standard,2024-12-05,DIVISLAB,2024-12
"Share Market Highlights 4 December 2024: Sensex climbs for fourth consecutive day, boosted by bank stocks",BusinessLine,2024-12-04,DIVISLAB,2024-12
Welspun Specialty Solutions announces change in CFO,Business Standard,2024-12-19,DIVISLAB,2024-12
Union Finance Minister Nirmala Sitharaman chairs fourth Pre-Budget Consultation,Business Standard,2024-12-27,DIVISLAB,2024-12
"Plans underway for bigger role for TReDS, to enrol million MSMEs in 2 years",Business Standard,2024-12-27,DIVISLAB,2024-12
