Heading,Source,Date,Symbol
Share price of Shriram Finance falls as Nifty weakens,The Economic Times,17 Dec 2024,SHRIRAMFIN
"Shriram Finance exits housing finance biz, sells 85% stake to Warbug Pincus for ₹3,929 crore",Mint,11 Dec 2024,SHRIRAMFIN
Shriram Finance stock in focus after selling 84% stake in housing finance arm to Warburg Pincus for Rs...,Moneycontrol,12 Dec 2024,SHRIRAMFIN
Shriram Finance shares rise 3% as Co fixes record date for stock-split,Business Standard,23 Dec 2024,SHRIRAMFIN
Shriram Finance completes sale of housing finance arm,Financial Express,12 Dec 2024,SHRIRAMFIN
"Shriram Finance Stock Split: 1:5 Ratio, January 10, 2025 Record Date; Your Next Buy?",Goodreturns,23 Dec 2024,SHRIRAMFIN
This Nifty stock entered bear territory; should you buy?,Business Today,18 Dec 2024,SHRIRAMFIN
"Shriram Finance finalises ₹3,929 crore stake sale in housing unit to Warburg Pincus",CNBC TV18,11 Dec 2024,SHRIRAMFIN
"Shriram Finance floats new arm for green finance business, eyes AUM of ₹5,000 cr.",The Hindu,20 Dec 2024,SHRIRAMFIN
"Buy Shriram Finance, target price Rs 3,825: Axis Securities",The Economic Times,23 Dec 2024,SHRIRAMFIN
