Heading,Source,Date,Symbol
"Breakout Stocks: How to trade Tech Mahindra, BSE and CDSL on Monday",The Economic Times,8 Dec 2024,TECHM
"Tech Mahindra Q3 Results Date, Time FY 2024-2025: Check quarterly earnings schedule of IT giant",ET Now,31 Dec 2024,TECHM
Tech Mahindra Experiences Revision in Its Stock Evaluation Amid Strong Financial Performance,MarketsMojo,2 Dec 2024,TECHM
Tech Mahindra gets board approval for merger of its subsidiary Eventus Solutions with parent company,Financial Express,11 Dec 2024,TECHM
"Tech Mahindra, ServiceNow collaborate to offer Gen AI management solutions",Business Standard,12 Dec 2024,TECHM
"Tech Mahindra CEO plans to take this 'route' to close gap with TCS, Infosys, Wipro and HCL Tech",Times of India,22 Dec 2024,TECHM
"Anand Mahindra's message to employees on New Year 2025: Audacity, innovation, manifestation & more",Mint,1 Jan 2025,TECHM
"Trade Spotlight: How should you trade Sundaram Clayton, EMS, ICICI Bank, BSE, PCBL, Tech Mahindra, Greaves...",Moneycontrol,5 Dec 2024,TECHM
"India's Tech Mahindra aiming for bigger bite of bank tech spends, CEO says",Reuters,19 Dec 2024,TECHM
HDFC Bank to Tech Mahindra: These stocks rally over 2% to hit 52-week high,Upstox,4 Dec 2024,TECHM
