Heading,Source,Date,Symbol,Month
"Axis Bank Share Price Highlights : Axis Bank closed today at ₹1149.2, up 0.05% from yesterday's ₹1148.65 | Stock Market News",Mint,2024-12-16,AXISBANK,2024-12
"Top stocks for 2025: Axis Bank, Maruti Suzuki, KPIT Tech, Zee Entertainment, SAMIL among top 12 picks for JM Financial Services",Financial Express,2024-12-16,AXISBANK,2024-12
Axis Bank Credit Card Latest Rules Kick In From Today 20 December 2024 --Details You Need To Know,Zee News,2024-12-20,AXISBANK,2024-12
"Sensex, Nifty today: Why stock market is falling ahead of Fed outcome",Business Today,2024-12-18,AXISBANK,2024-12
"Axis Bank credit card rules change from December 20. From finance charges to cash payment fees, check revised rates",Mint,2024-12-19,AXISBANK,2024-12
"Stock market today: Sensex, Nifty down for 5th session; here's why",Business Today,2024-12-20,AXISBANK,2024-12
Investors lose ₹18.5 lakh crore as Nifty records worst 2024 week,Hindustan Times,2024-12-21,AXISBANK,2024-12
"Trending stocks today: Asian Paints, Axis Bank, Exide, Sagility India & more",News9live,2024-12-20,AXISBANK,2024-12
