Heading,Source,Date,Symbol,Month
Six Stocks In News At Noon: Cipla To Shriram Finance — Top Gainers And Losers,NDTV Profit,2024-12-17,GRASIM,2024-12
"Tracking buzzing stocks: Top gainers include Cipla, top losers include Shriram Finance, Grasim Industries, Hero MotoCorp on December 17- Check complete list here - Market News",Financial Express,2024-12-17,GRASIM,2024-12
"Stock Market News Today Live Updates on December 17, 2024 : Wall Street today: US stocks slip after strong retail sales data | Stock Market News",Mint,2024-12-17,GRASIM,2024-12
"Stock Market Crash Highlights: Sensex sinks 1064pts, Nifty ends below 24340; Auto, banks, metals dip",Business Standard,2024-12-17,GRASIM,2024-12
Top 5 Losers of NIFTY 50: A Day of Decline for Leading Stocks,Editorji,2024-12-17,GRASIM,2024-12
