Heading,Source,Date,Symbol
Why Tata Steel Share Price is Falling,Equitymaster,20 Dec 2024,TATASTEEL
"Stocks in news: Indian Oil, Tata Steel, TCS, Infosys, Airtel, Tata Consumer",The Economic Times,20 Dec 2024,TATASTEEL
"Tata Steel Share Price Highlights : Tata Steel closed today at ₹143.3, down -0.83% from yesterday's ₹144.5 | Stock Market News",Mint,19 Dec 2024,TATASTEEL
Tata Steel Makes History with India’s First-Ever All-Women Shift in an iron ore mine,Tata Steel,16 Dec 2024,TATASTEEL
"1:10 Split, 1:2 Bonus, 30 Dividends: Tata's Steel Stock Dips 5% Last Week; Buy For Rs 150-175 Target",Goodreturns,22 Dec 2024,TATASTEEL
