Heading,Source,Date,Symbol
Why Bajaj Finserv Share Price is Rising,Equitymaster,2 Sept 2024,BAJAJFINSV
"Bajaj Finance, Bajaj Finserv stocks gain up to 5% as Bajaj Housing Finance sets mega-IPO date",Moneycontrol,2 Sept 2024,BAJAJFINSV
"Bajaj Housing Finance IPO: All you need to know about the ₹6,560 crore issue - Hindustan Times",Hindustan Times,3 Sept 2024,BAJAJFINSV
"Bajaj Finance, Bajaj Finserv shares jump 5% on Bajaj Housing Finance IPO date announcement",Mint,2 Sept 2024,BAJAJFINSV
Bajaj Housing Finance IPO: How does it stack up against LIC Housing and PNB Housing Finance,Mint,6 Sept 2024,BAJAJFINSV
