Heading,Source,Date,Symbol
"Reliance Industries share are down by -1.85%, Nifty down by -0.96%",Mint,6 Sept 2024,RELIANCE
Reliance Industries approves 1:1 bonus shares for shareholders,India TV News,5 Sept 2024,RELIANCE
RIL bonus shares: JM says Reliance stock may outperform Nifty. Here's why,Business Today,3 Sept 2024,RELIANCE
Reliance Industries board approves bonus share issue in 1:1 ratio,Business Standard,5 Sept 2024,RELIANCE
RIL bonus issue: Reliance stock to outperform Nifty 50 in near-term? Here's what JM's technical analysis reveals,Mint,4 Sept 2024,RELIANCE
