Heading,Source,Date,Symbol
"Shares to buy: Prashanth Tapse of Mehta Equities suggests buying Apollo Hospitals, Power Grid, SBI in the short term",Mint,4 Apr 2025,APOLLOHOSP
Is Apollo Hospitals Enterprise Limited's (NSE:APOLLOHOSP) Stock's Recent Performance Being Led By Its Attractive Financial Prospects?,Simply Wall Street,21 Apr 2025,APOLLOHOSP
Apollo Hospitals Planning Buyouts to Boost North India Footprint,Bloomberg,11 Apr 2025,APOLLOHOSP
Apollo Hospital Share Price Highlights: Apollo Hospital Stock Price History,The Economic Times,11 Apr 2025,APOLLOHOSP
Apollo Hospitals Eyes Expansion via Acquisitions and Greenfield Projects to Strengthen Market Leadership in India's Evolving Healthcare Landscape,eHealth Magazine,15 Apr 2025,APOLLOHOSP
"Apollo Hospitals eyes acquisitions in North India; ₹6,000-crore capacity expansion plans underway",BusinessLine,15 Apr 2025,APOLLOHOSP
"Adani Ports, Piramal Pharma: Six must-have stocks to beat the markets",Business Standard,2 Apr 2025,APOLLOHOSP
Apollo Diagnostics gets digi-smart laboratory for accurate diagnosis,The Hindu,1 month ago,APOLLOHOSP
"Apollo Hospitals to invest ₹6,000 crore to add 3,500 new beds as chronic diseases rise | Company Business News",Mint,9 Apr 2025,APOLLOHOSP
From Re 1 Treatments To Rs 1 Lakh Crore Empire: The Man Behind Apollo Hospitals,News18,1 month ago,APOLLOHOSP
