Heading,Source,Date,Symbol
Cipla Share Price Highlights: Cipla Stock Price History,The Economic Times,4 Apr 2025,CIPLA
Cipla Q4 Results FY 2025 Date and Time: Dividend in upcoming board meeting – Check quarterly earnings announcement schedule,ET Now,7 Apr 2025,CIPLA
"Cipla shares: Nomura says 'Buy' pharma stock; target price set at Rs 1,780",Business Today,14 Apr 2025,CIPLA
"Biocon, Cipla: Nifty Pharma down 6% as US eyes possible tariffs on sector",Business Standard,4 Apr 2025,CIPLA
"Pharma Shares & Stocks Updates: Ipca Laboratories, Lupin, Sun Pharma and Cipla lead gainers surging over 4%, Trump’s tariff exemption boosts investor sentiment",BusinessLine,3 Apr 2025,CIPLA
Does US approval for key cancer drug make Cipla shares an attractive buy amid tariff concerns? | Stock Market News,Mint,17 Apr 2025,CIPLA
Cipla Shares Fall 5% As Donald Trump Hints At ‘Never Seen Before’ Tariffs On Pharma Sector; Should You Buy?,Goodreturns,4 Apr 2025,CIPLA
Why is the market falling today? 4 reasons…,Financial Express,4 Apr 2025,CIPLA
"Aurionpro Solutions, Muthoot Finance, Gravita India, Lloyds Metals, Goldiam Int'l, Cipla, Persistent Systems: Top buzzing stocks",Upstox,11 Apr 2025,CIPLA
Cipla shares gain 5% on USFDA nod for generic cancer drug; set to launch in the US,CNBC TV18,11 Apr 2025,CIPLA
