Heading,Source,Date,Symbol
4QFY2025 and FY2025 Production and Delivery Volumes (Provisional),Tata Steel,7 Apr 2025,TATASTEEL
"Stocks to Watch Today: Tata Steel, Yes Bank, Godrej Properties, AstraZeneca Pharma, IndusInd Bank, Nykaa,...",Moneycontrol,7 Apr 2025,TATASTEEL
"Tata Steel share price rises 5% on Q4 business update, pares gains later",Business Standard,8 Apr 2025,TATASTEEL
"Buy Tata Steel, target price Rs 150: Axis Securities",The Economic Times,15 Apr 2025,TATASTEEL
Tata Steel shares in focus today post Q4 business updates,Business Today,8 Apr 2025,TATASTEEL
"Stocks to watch on April 17: Wipro, Gensol, Tata Steel, BEL, Paytm, Hero MotoCorp",India Today,17 Apr 2025,TATASTEEL
Tata Steel share price: Time to BUY? Stock in action after this development - Details,ET Now,11 Apr 2025,TATASTEEL
Tata Steel Nederland launches major revamp to boost efficiency and profitability,CNBC TV18,16 Apr 2025,TATASTEEL
"Should you buy Tata Steel, OIL, M&M or IIFL Finance for long term now?",Zee Business,23 Apr 2025,TATASTEEL
"Stocks to Watch Today, 7th April 2025: Tata Steel, IndusInd Bank, Bajaj Housing Finance, Nykaa, and more",Groww,7 Apr 2025,TATASTEEL
