Heading,Source,Date,Symbol,Month
"Divi's Labs set for continued growth, valuation may cap upside: Analysts",Business Standard,2024-11-11,DIVISLAB,2024-11
"Stocks in news: Tata Motors, JSW Steel, LIC, Asian Paints, ITI, Divis Labs, Ola Electrics & GR Infra",Business Today,2024-11-11,DIVISLAB,2024-11
"Stocks To Watch: Tata Motors, Asian Paints, OLA Electric, Wipro, LIC, Divi’s Laboratories, Aarti Industries, Hindustan Aeronautics",Financial Express,2024-11-11,DIVISLAB,2024-11
"Stock Alert: LIC, Divi's Lab, Asian Paints, Metropolis Healthcare, PFC, JSW Steel",Business Standard,2024-11-11,DIVISLAB,2024-11
Aarti Industries tanks 10% after PAT drops in Q2FY25 earnings; details,Business Standard,2024-11-11,DIVISLAB,2024-11
Stock market today: Trade setup for Nifty 50 to Q2 results today; five stocks to buy or sell on Thursday — Nov 14,Mint,2024-11-14,DIVISLAB,2024-11
Biocon share jumps 6% on USFDA's 'VAI' tag to Bengaluru facility; details,Business Standard,2024-11-11,DIVISLAB,2024-11
MF trends: Net equity inflows hit all-time high in Oct 24; up 75% this year,Business Standard,2024-11-14,DIVISLAB,2024-11
"Meet richest man in Hyderabad, failed Class 12th, became doctor, now runs business worth Rs 1530000000000, hi",India.Com,2024-11-17,DIVISLAB,2024-11
RBI asks shadow banks to give information on supply-chain financing,Business Standard,2024-11-15,DIVISLAB,2024-11
