Heading,Source,Date,Symbol
SBI Life Insurance Company Ltd gains for fifth session,Business Standard,1 month ago,SBILIFE
Buy SBI Life Insurance Company; target of Rs 2048: Geojit Financial Services,Moneycontrol,1 month ago,SBILIFE
"Max Financial, HDFC Life, SBI Life On CLSAs Radar As Regulatory Concerns Ease",NDTV Profit,1 month ago,SBILIFE
"Public companies account for 55% of SBI Life Insurance Company Limited's (NSE:SBILIFE) ownership, while institutions account for 30%",Simply Wall Street,1 month ago,SBILIFE
"Small-cap stock below ₹50: LIC, SBI Life-owned NBFC in focus after THIS fundraise move",Mint,2 May 2025,SBILIFE
Stock Radar: SBI Life breaks out from a Pennant formation on daily charts; what should investors do?,The Economic Times,1 month ago,SBILIFE
Volumes spurt at SBI Life Insurance Company Ltd counter,Business Standard,1 month ago,SBILIFE
Private life insurers post slowest annual growth in 6 years. Is this the bottom?,CNBC TV18,1 month ago,SBILIFE
"SBI Life Insurance, Vidyaniti buy 4.25% unit-holding in NHIT for ₹1,100 cr",BusinessLine,1 month ago,SBILIFE
