Heading,Source,Date,Symbol
Nestle India stock drops 3% after Q1 earnings miss street estimates,Business Standard,25 Jul 2024,NESTLEIND
"Nestle India Q1 results miss estimate, net profit rises 7% on-year to Rs 747 crore; shares fall",Moneycontrol,25 Jul 2024,NESTLEIND
"Nestle India Q1 Results: Net profit rises 7% to ₹746.6 crore, revenue up 3.3% YoY",Mint,25 Jul 2024,NESTLEIND
"Nestle Q1 Results Live Updates: PAT rises 7% YoY at Rs 747 cr, revenue 3%",The Economic Times,25 Jul 2024,NESTLEIND
"Nestle India Q1 Results Highlights: Net profit rises 7% YoY to ₹746.6 crore, revenue up 3.3% YoY",Upstox,25 Jul 2024,NESTLEIND
"Nestle India misses Q1 estimates, posts slowest revenue growth in 8 years",Reuters,24 Jul 2024,NESTLEIND
"Nestle India's Q4 financial results show strong growth and efficiency, receives 'Buy' call from MarketsMOJO",MarketsMojo,25 Jul 2024,NESTLEIND
"Nestle India Q1 Preview: Price hikes to support bottom-line, eyes on commodity inflation",Moneycontrol,24 Jul 2024,NESTLEIND
