Heading,Source,Date,Symbol
"Apollo Hospitals sells 16.9% stake in subsidiary Apollo Healthco for ₹2,475 crore to Rasmeli",CNBC TV18,27 Sept 2024,APOLLOHOSP
"Apollo Hospitals Strikes Rs 2,475 Crore Deal With Rasmeli, Sells 16.9% Stake In Apollo Healthco; Details",Goodreturns,28 Sept 2024,APOLLOHOSP
At multi-year highs: These 6 stocks witness 5-year swing high breakout,The Economic Times,30 Sept 2024,APOLLOHOSP
"Stock market today: Trade setup for Nifty 50 to global markets outlook, five stocks to buy or sell on Tuesday — Sept 24",Mint,24 Sept 2024,APOLLOHOSP
Share Market Highlights 4 September 2024: Global cues trigger sharp selloff in Indian stocks; IT sector takes major hit,BusinessLine,4 Sept 2024,APOLLOHOSP
Superstar Rajinikanth admitted to Chennai Hospital; condition 'stable',Business Standard,1 Oct 2024,APOLLOHOSP
Bajaj Housing Finance IPO: Market cap at Rs 1 lakh crore on listing day? Check how big it will be post listing,Business Today,12 Sept 2024,APOLLOHOSP
"Stocks To Watch: BSE, Mahanagar Gas, Welspun Enterprises, BEL, RIL, Radico Khaitan, Tata Motors, Adani Enterprises, Manba Finance - Market News",Financial Express,30 Sept 2024,APOLLOHOSP
"Healthcare stocks with avg revenue per occupied bed of up to ₹ 65,924 to keep on your radar",Trade Brains,12 Sept 2024,APOLLOHOSP
Sebi Board Meeting: Regulator approves new asset class for HNIs with riskier appetite,The Economic Times,1 Oct 2024,APOLLOHOSP
