Heading,Source,Date,Symbol
HDFC Life Insurance Company Share Price Today Updates: HDFC Life Insurance Company Sees Incremental Dail...,The Economic Times,19 Sept 2024,HDFCLIFE
"GST indecision pressure insurance stocks; HDFC Life, SBI Life shed up to 4%",Business Standard,10 Sept 2024,HDFCLIFE
"HDFC Life maintains 15% growth target for FY25, expects margins around 26%",CNBC TV18,5 Sept 2024,HDFCLIFE
"Stocks in news: HDFC Life, Tata Power, Easy Trip, Delta Corp, MCX, Bazaar Style & Gillette",Business Today,25 Sept 2024,HDFCLIFE
"Analyst Call Tracker August 2024: Shriram Finance hits hattrick as top pick on Street, HDFC Life makes...",Moneycontrol,11 Sept 2024,HDFCLIFE
HDFC Life Insurance Company Share Price Today Updates: HDFC Life Insurance Shares Decline 1.33% Amidst Ma...,The Economic Times,13 Sept 2024,HDFCLIFE
HDFC Life to Offer Credit Life Solutions to Customers of Sundaram Finance,ANI News,30 Sept 2024,HDFCLIFE
Rishabh Pant’s story powers HDFC Life’s campaign,ET BrandEquity,9 Sept 2024,HDFCLIFE
"HDFC Life Insurance to finalise terms for ₹2,000-crore debt issuance",CNBC TV18,24 Sept 2024,HDFCLIFE
HDFC Life Insurance Company Stocks Updates: HDFC Life Insurance Company Sees Minor Daily Decline Amid St...,The Economic Times,16 Sept 2024,HDFCLIFE
