Heading,Source,Date,Symbol
"Nestle India Q2 results FY2024-25 date, time: Maggi, KitKat maker's quarterly earnings schedule",ET Now,24 Sept 2024,NESTLEIND
"Stock Market Highlights, Sept 12: Benchmarks log record close; Sensex adds 1439pts, Nifty near 25400",Business Standard,12 Sept 2024,NESTLEIND
"Trade Spotlight: How should you trade Bajaj Finance, Nestle, Indian Hotels, Natco Pharma, Havells and others on Thursday?",TradingView,18 Sept 2024,NESTLEIND
"Stock Market Highlights: Markets end lower! Nifty at 25,350, Sensex down 200 points; Banks outperform",Financial Express,18 Sept 2024,NESTLEIND
"Stock Market Highlights September 19, 2024: Sensex, Nifty close higher after Fed rate cut; profit-booking caps gains",BusinessLine,19 Sept 2024,NESTLEIND
Ahead of Market: 10 things that will decide stock action on Tuesday,The Economic Times,2 Sept 2024,NESTLEIND
"Sensex rallies over 1,500 points, Nifty surges above 25,400",The Indian Express,12 Sept 2024,NESTLEIND
Up 146% in 3 years: Can this top NBFC stock keep its momentum going? | Stock Market News,Mint,16 Sept 2024,NESTLEIND
"Trade Spotlight: How should you trade Ujjivan SFB, JSW Energy, Marico, Thermax, SBI Life and others on...",Moneycontrol,23 Sept 2024,NESTLEIND
"Stock Market Highlights, Sept 03: Nifty closes nearly flat, Sensex in red; broader markets gain",Business Standard,3 Sept 2024,NESTLEIND
