Heading,Source,Date,Symbol
Banking Central | What does Kotak Mahindra Bank’s leadership transition signal to investors?,Moneycontrol,1 month ago,KOTAKBANK
"Nifty Top Gainers, Losers On June 9: Jio Financial, Kotak Mahindra Bank To Eternal",NDTV Profit,1 month ago,KOTAKBANK
"Insiders At Kotak Mahindra Bank Sold ₹1.1b In Stock, Alluding To Potential Weakness",Simply Wall Street,1 month ago,KOTAKBANK
"Bank Nifty Hits Record High: Kotak Mahindra, Federal, Axis, Bandhan, PNB, AU Small Finance Among Top Gainers",Goodreturns,1 month ago,KOTAKBANK
"Kotak Mahindra Bank appoints Srishti Sethi as Group Chief Risk Officer, succeeding Paul Parambi",The Economic Times,1 month ago,KOTAKBANK
"Kotak Mahindra's Shanti Ekambaram tops 2025 Women Leaders list, says Hurun",Business Standard,1 month ago,KOTAKBANK
