Heading,Source,Date,Symbol
LTIMindtree Ltd up for fifth session,Business Standard,1 month ago,LTIM
"Stock Picks: Sagar Doshi suggests Tata Motors, LTIMindtree, ZEEL shares to buy today - 4 June",Mint,1 month ago,LTIM
"Coforge, Mphasis, other IT shares rise up to 4% on optimism over US-China trade talks",Moneycontrol,1 month ago,LTIM
"Share Market Today | Latest Stock Market News, Sensex Today and Nifty Live Updates",Business Standard,1 month ago,LTIM
"Adani Green Energy, LTIMindtree among 5 stocks with long buildup",The Economic Times,1 month ago,LTIM
