Heading,Source,Date,Symbol
"From Coal India, Gensol Engineering, Hindustan Copper to Maruti Suzuki - Here are 8 stocks to watch - Market News",Financial Express,1 month ago,MARUTI
Maruti Suzuki India Shares Rise by Over 2%,Moneycontrol,1 month ago,MARUTI
"Stocks in news: Oriental Carbon, Maruti Suzuki, IndiGo, Texmaco Rail, Wipro",The Economic Times,1 month ago,MARUTI
"M&M, Maruti Suzuki India Drag Nifty Auto As Concern Over Rare Earth Material Supply Weighs",NDTV Profit,1 month ago,MARUTI
"Stocks to watch: Maruti Suzuki, IIFL Finance, Wipro, Texmaco, IndiGo among shares in focus today",Mint,1 month ago,MARUTI
Maruti Suzuki India shares decline in today's session amid high traded volume,TradingView,1 month ago,MARUTI
maruti suzuki india has launched a new finance scheme aimed at helping existing small car owners,ICICI Direct,1 month ago,MARUTI
Maruti Suzuki share price jumps 3%; plans to invest Rs 925 crore to expand solar capacity,ET Now,1 month ago,MARUTI
