Heading,Source,Date,Symbol
TrucksUp partners with Shriram Finance,The Times of India,1 month ago,SHRIRAMFIN
Shriram Finance the next big NBFC bet? 4 reasons why Motilal Oswal sets Rs 800 target price,Financial Express,1 month ago,SHRIRAMFIN
Bajaj Finance vs Jio Finance vs Shriram Finance vs Muthoot Finance: All Top Brokerages Bet on This NBFC Stock,Goodreturns,1 month ago,SHRIRAMFIN
"Shriram Finance, Muthoot Finance in focus as financial stocks rally after RBI’s 50 bps rate cut; check key technical levels",Upstox,1 month ago,SHRIRAMFIN
TrucksUp and Shriram Finance Ltd. announces strategic JV,Maritime Gateway,1 month ago,SHRIRAMFIN
