Heading,Source,Date,Symbol
"Adani Group Stocks, Adani Energy Share Price Highlights: Adani stocks dip although MSCI lifts restrictions in August 2024 index review",BusinessLine,13 Aug 2024,ADANIENT
Adani planning to raise $1.2 bn for flagship firm via share sale: Report,Business Standard,7 Aug 2024,ADANIENT
Adani Enterprises to transfer Adani Wilmar stake to its shareholders,Mint,1 Aug 2024,ADANIENT
"Adani Power, Adani Enterprises, Adani Green, Adani Energy: Adani stocks fall up to 17% after Hindenburg Research report; what's next?",Business Today,12 Aug 2024,ADANIENT
"Adani Group stocks fall up to 7% on Hindenburg report; investors lose Rs 53,000 crore",Times of India,12 Aug 2024,ADANIENT
Adani Group companies post 50% jump in PAT in Q1,Financial Express,19 Aug 2024,ADANIENT
Adani Stocks Drop as Hindenburg Row With India Regulator Worsens,Bloomberg.com,12 Aug 2024,ADANIENT
"Adani Group looking to sell up to 5 percent stake in Adani Power, Ambuja Cements: CNBC Awaaz",Moneycontrol,22 Aug 2024,ADANIENT
Adani Group rocked by Hindenburg allegations against SEBI,Al Jazeera,12 Aug 2024,ADANIENT
Adani Wilmar surges 10% as Adani Ent to demerge food-FMCG biz to company,Business Standard,2 Aug 2024,ADANIENT
