Heading,Source,Date,Symbol
HDFC Bank taps retail bankers as wealth managers amid talent crunch,Business Standard,21 Aug 2024,HDFCBANK
HDFC Bank plans to sell $1.2 billion of loans via rare debt tool,The Economic Times,30 Aug 2024,HDFCBANK
"Motilal Oswal, Kotak Equities bullish on HDFC Bank, see over 13% upside potential",Moneycontrol,19 Aug 2024,HDFCBANK
HDFC Bank shares slip 9% from one-year high levels; here's what analysts say,Business Today,19 Aug 2024,HDFCBANK
HDFC Bank: Will the elephant ever dance again? | Stock Market News,Mint,28 Aug 2024,HDFCBANK
HDFC-HDFC Bank merger among largest and most complex in India Inc's history: Atanu Chakraborty,CNBC TV18,9 Aug 2024,HDFCBANK
HDFC Bank Plans to Sell $1.2 Billion of Loans Via Rare Debt Tool,Bloomberg.com,30 Aug 2024,HDFCBANK
"HDFC Bank Stocks Updates: HDFC Bank Closes Slightly Higher, Registers 0.16% Increase in Share Price",The Economic Times,20 Aug 2024,HDFCBANK
Erstwhile HDFC investors question HDFC Bank for lower dividend,Moneycontrol,12 Aug 2024,HDFCBANK
"From Canara Bank to HDFC Bank, banks up the ante on deposit drive",Business Standard,14 Aug 2024,HDFCBANK
