Heading,Source,Date,Symbol
SBI pushes into wealth management with vigour as wealthy people surge,Business Standard,6 Aug 2024,SBIN
Will strive to make SBI most valued financial institution: Chairman Setty,The Economic Times,28 Aug 2024,SBIN
"SBI plunges over 3% on lower deposit growth, brokerage recommendations mixed",Financial Express,5 Aug 2024,SBIN
SBI aims to sell Yes Bank stake worth $2.2 billion by end-March: Report,Moneycontrol,13 Aug 2024,SBIN
Karnataka Govt vs SBI and PNB explained: The fallout and bank responses,CNBC TV18,15 Aug 2024,SBIN
"Karnataka government to close SBI, PNB accounts | Latest News India - Hindustan Times",Hindustan Times,15 Aug 2024,SBIN
SBI share price falls over 3% after Q1FY25 results. Is this a stock to buy today?,Mint,5 Aug 2024,SBIN
SBI MD Ashwini Tewari hopes market correction over time will get funds back to banking system,The Economic Times,28 Aug 2024,SBIN
"Why SBI stock fell 5% after Q1 result? Buy, sell, hold? Check strategy here",Business Standard,5 Aug 2024,SBIN
"Stocks to buy: SBI, ICICI Bank, M&M among 12 stocks that may rise 5-16% in next 3-4 weeks, say analysts",Mint,12 Aug 2024,SBIN
