Heading,Source,Date,Symbol
"Hero MotoCorp: Up 76% in last 1 year, this auto stock is Axis Securities' ‘pick of the week’ – 3 key reasons why",Mint,29 Apr 2024,HEROMOTOCO
"Hero MotoCorp opens assembly facility with 75,000 units capacity in Nepal",Business Standard,21 Apr 2024,HEROMOTOCO
"Top two-wheeler players Hero MotoCorp, HMSI lose market share as others, EV makers gain",BusinessLine,9 Apr 2024,HEROMOTOCO
"Hero MotoCorp records 56 lakh unit sales in FY24, 4.9 lakh units in March - Bike News",Financial Express,2 Apr 2024,HEROMOTOCO
"Ahead of IPO, Hero FinCorp writes off bad loans worth around Rs 1,200 crore",Moneycontrol,8 Apr 2024,HEROMOTOCO
"Stock recommendations by analyst for April 26: Hero MotoCorp, GMR Infra and REC",BUSINESS TODAY,26 Apr 2024,HEROMOTOCO
Hero MotoCorp's CTO Arun Jaura steps down to pursue 'personal endeavours',Deccan Herald,22 Apr 2024,HEROMOTOCO
"IPO-bound Hero FinCorp clears bad loans worth ₹1,200 crore",NewsBytes,8 Apr 2024,HEROMOTOCO
Hero MotoCorp Sees A Change In Top Management; Vikram Kasbekar To Head R&D,carandbike,23 Apr 2024,HEROMOTOCO
Boardroom Leela: Why are ITC and Hotel Leela at loggerheads?,The Economic Times,16 Apr 2024,HEROMOTOCO
