Heading,Source,Date,Symbol
Larsen & Toubro Stocks Live Updates: Larsen & Toubro Sees Incremental Growth with 0.47% Increase Today a...,The Economic Times,25 Apr 2024,LT
Stocks in focus: Ruchit Jain of 5paisa recommends buying Larsen & Toubro and ICICI Prudential today,Mint,9 Apr 2024,LT
"L&T Finance Q4 results: Net profit up 11%, NIM plus fees stands at 11.15%",Business Standard,27 Apr 2024,LT
L&T trades higher after selling off entire stake in infra development arm,Moneycontrol,12 Apr 2024,LT
L&T buyback: Should investors tender their shares? Check analysts views,Zee Business,3 Apr 2024,LT
L&T fined ₹60.84 crore by Qatar for variation in income,CNBC TV18,5 Apr 2024,LT
L&T’s Tech Avatar,Fortune India,1 Apr 2024,LT
L&T sells stake in L&T Infrastructure Development Projects,BusinessLine,11 Apr 2024,LT
"LTTS shares fall 9% as FY25 guidance lowers earnings visibility; Price targets, outlook & more",Business Today,26 Apr 2024,LT
"L&T Finance Q4 results: PAT up 11% at Rs 554 cr, retail book grows 31%",Business Standard,27 Apr 2024,LT
